{
  "schemaVersion": 1,
  "source": {
    "platform": "canvas",
    "course": {
      "id": "unknown",
      "name": "心理与精神健康",
      "code": "HLT3202G",
      "extra": {
        "note": "Canvas 课程 id 未从现有证据取得；平台侧节次 id 见 sessions"
      }
    },
    "capturedAt": "2026-10-15T20:09:21+08:00",
    "platformSubtitles": "unusable",
    "sessions": [
      {
        "label": "L08 第15节 1355",
        "lectureId": "L08",
        "platformSessionId": "179741",
        "letiNumber": 15,
        "beginTime": "2026-10-13T13:55:00+08:00",
        "classDate": "2026-10-13",
        "partOfSplit": 1,
        "durationSec": 3308.6,
        "usedDeck": "第9次课.pptx",
        "deckCoverageNote": "0:00–35:07 未使用 S84；该段先回顾 UNIT 5 眼动指标，再进入 UNIT 6 实验心理学",
        "media": {
          "videoPath": null,
          "videoSha256": null,
          "recordVariant": null,
          "archived": false,
          "cleanedUpAt": "2026-10-15",
          "note": "原始 MP4 未随仓库提交，需从平台重新获取；16 kHz 单声道 WAV 处理完成后已删除"
        },
        "transcript": {
          "file": "09 参考资料/附件/L08 字幕/L08 第15节 1355.md",
          "model": "large-v3",
          "chunkSec": 600,
          "segmentCount": 533,
          "segments": [],
          "diarized": false,
          "speakerLabelsAreInferred": true,
          "knownMishearings": [
            "declarative→decorative",
            "2,500 objects→22 models",
            "saccade→second/circuit",
            "go cue→GoQ"
          ],
          "qualityNote": "未做说话人分离；已知误听较多，不能作为逐字教师引语"
        },
        "platformArtifacts": [
          {
            "kind": "ai-summary",
            "file": "09 参考资料/附件/L08 字幕/L08 第15节 1355 平台AI概要.json"
          },
          {
            "kind": "platform-asr",
            "file": "09 参考资料/附件/L08 字幕/L08 第15节 1355 平台语音转写.json"
          },
          {
            "kind": "ppt-track-manifest",
            "file": "09 参考资料/附件/L08 字幕/L08 第15节 1355 平台课件轨清单.json",
            "note": "imageSeekTime 单位为秒；showFlag 全为 true，不能用来判断『是否放映』",
            "recordCount": 68
          }
        ]
      },
      {
        "label": "L08 第16节 1450",
        "lectureId": "L08",
        "platformSessionId": "180045",
        "letiNumber": 16,
        "beginTime": "2026-10-13T14:50:00+08:00",
        "classDate": "2026-10-13",
        "partOfSplit": 2,
        "durationSec": 3289.0,
        "usedDeck": "第8次课.pdf",
        "deckCoverageNote": "00:01–45:42 覆盖 S84 p9–p35；46:41 与 48:28 还有两页不在 S84 内",
        "media": {
          "videoPath": null,
          "videoSha256": null,
          "recordVariant": null,
          "archived": false,
          "cleanedUpAt": "2026-10-15",
          "note": "原始 MP4 未随仓库提交，需从平台重新获取；16 kHz 单声道 WAV 处理完成后已删除"
        },
        "transcript": {
          "file": "09 参考资料/附件/L08 字幕/L08 第16节 1450.md",
          "model": "large-v3",
          "chunkSec": 600,
          "segmentCount": 676,
          "segments": [],
          "diarized": false,
          "speakerLabelsAreInferred": true,
          "knownMishearings": [],
          "qualityNote": "未做说话人分离；已知误听较多，不能作为逐字教师引语"
        },
        "platformArtifacts": [
          {
            "kind": "ai-summary",
            "file": "09 参考资料/附件/L08 字幕/L08 第16节 1450 平台AI概要.json"
          },
          {
            "kind": "platform-asr",
            "file": "09 参考资料/附件/L08 字幕/L08 第16节 1450 平台语音转写.json"
          },
          {
            "kind": "ppt-track-manifest",
            "file": "09 参考资料/附件/L08 字幕/L08 第16节 1450 平台课件轨清单.json",
            "note": "imageSeekTime 单位为秒；showFlag 全为 true，不能用来判断『是否放映』",
            "recordCount": 63
          }
        ]
      }
    ]
  },
  "slides": [
    {
      "index": 1,
      "file": "09 参考资料/附件/L08 课件 PDF/PDF p01.jpg",
      "source": "pdf-render",
      "pdfPage": 1,
      "projections": [
        {
          "sessionIndex": 1,
          "startSec": 2107,
          "startMmss": "35:07",
          "timecodeSource": "platform-imageSeekTime-sec",
          "rawTimecode": "2107",
          "isReplay": false
        }
      ],
      "title": "Memory-guided saccades：延迟眼跳任务",
      "contentType": "slide",
      "footerUnit": "EYE TRACKING",
      "pageNoScope": "section",
      "pageNoExpected": "01",
      "pageNoFullOcr": "01",
      "pageNoFooterOcr": "01",
      "pageNoNormalized": "01",
      "pageNoStatus": "verified"
    },
    {
      "index": 2,
      "file": "09 参考资料/附件/L08 课件 PDF/PDF p02.jpg",
      "source": "pdf-render",
      "pdfPage": 2,
      "projections": [
        {
          "sessionIndex": 1,
          "startSec": 2252,
          "startMmss": "37:32",
          "timecodeSource": "platform-imageSeekTime-sec",
          "rawTimecode": "2252",
          "isReplay": false
        }
      ],
      "title": "Why does the task include a delay?（延迟的作用）",
      "contentType": "slide",
      "footerUnit": "EYE TRACKING",
      "pageNoScope": "section",
      "pageNoExpected": "02",
      "pageNoFullOcr": "02",
      "pageNoFooterOcr": "02",
      "pageNoNormalized": "02",
      "pageNoStatus": "verified"
    },
    {
      "index": 3,
      "file": "09 参考资料/附件/L08 课件 PDF/PDF p03.jpg",
      "source": "pdf-render",
      "pdfPage": 3,
      "projections": [
        {
          "sessionIndex": 1,
          "startSec": 2358,
          "startMmss": "39:18",
          "timecodeSource": "platform-imageSeekTime-sec",
          "rawTimecode": "2358",
          "isReplay": false
        }
      ],
      "title": "Spatial accuracy：终点与目标的差多少？",
      "contentType": "slide",
      "footerUnit": "EYE TRACKING",
      "pageNoScope": "section",
      "pageNoExpected": "03",
      "pageNoFullOcr": "03",
      "pageNoFooterOcr": "03",
      "pageNoNormalized": "03",
      "pageNoStatus": "verified"
    },
    {
      "index": 4,
      "file": "09 参考资料/附件/L08 课件 PDF/PDF p04.jpg",
      "source": "pdf-render",
      "pdfPage": 4,
      "projections": [
        {
          "sessionIndex": 1,
          "startSec": 2454,
          "startMmss": "40:54",
          "timecodeSource": "platform-imageSeekTime-sec",
          "rawTimecode": "2454",
          "isReplay": false
        }
      ],
      "title": "Timing: when did the eyes move?",
      "contentType": "slide",
      "footerUnit": "EYE TRACKING",
      "pageNoScope": "section",
      "pageNoExpected": null,
      "pageNoFullOcr": null,
      "pageNoFooterOcr": null,
      "pageNoNormalized": null,
      "pageNoStatus": "missing",
      "pageNoNote": "无页脚数字；按设计如此，保留原样"
    },
    {
      "index": 5,
      "file": "09 参考资料/附件/L08 课件 PDF/PDF p05.jpg",
      "source": "pdf-render",
      "pdfPage": 5,
      "projections": [
        {
          "sessionIndex": 1,
          "startSec": 2535,
          "startMmss": "42:15",
          "timecodeSource": "platform-imageSeekTime-sec",
          "rawTimecode": "2535",
          "isReplay": false
        }
      ],
      "title": "Common metrics for saccade",
      "contentType": "slide",
      "footerUnit": "EYE TRACKING",
      "pageNoScope": "section",
      "pageNoExpected": null,
      "pageNoFullOcr": null,
      "pageNoFooterOcr": null,
      "pageNoNormalized": null,
      "pageNoStatus": "missing",
      "pageNoNote": "无页脚数字（底部为『数据来源』行）；按设计如此，保留原样"
    },
    {
      "index": 6,
      "file": "09 参考资料/附件/L08 课件 PDF/PDF p06.jpg",
      "source": "pdf-render",
      "pdfPage": 6,
      "projections": [
        {
          "sessionIndex": 1,
          "startSec": 2615,
          "startMmss": "43:35",
          "timecodeSource": "platform-imageSeekTime-sec",
          "rawTimecode": "2615",
          "isReplay": false
        }
      ],
      "title": "Applications of memory-guided saccades",
      "contentType": "slide",
      "footerUnit": "EYE TRACKING",
      "pageNoScope": "section",
      "pageNoExpected": "04",
      "pageNoFullOcr": "04",
      "pageNoFooterOcr": "04",
      "pageNoNormalized": "04",
      "pageNoStatus": "verified"
    },
    {
      "index": 7,
      "file": "09 参考资料/附件/L08 课件 PDF/PDF p07.jpg",
      "source": "pdf-render",
      "pdfPage": 7,
      "projections": [
        {
          "sessionIndex": 1,
          "startSec": 2746,
          "startMmss": "45:46",
          "timecodeSource": "platform-imageSeekTime-sec",
          "rawTimecode": "2746",
          "isReplay": false
        }
      ],
      "title": "单元导入：Memory systems and knowledge representation",
      "contentType": "slide",
      "footerUnit": "KNOWLEDGE REPRESENTATION（记忆系统导入）",
      "pageNoScope": "section",
      "pageNoExpected": "02",
      "pageNoFullOcr": "02",
      "pageNoFooterOcr": "02",
      "pageNoNormalized": "02",
      "pageNoStatus": "verified"
    },
    {
      "index": 8,
      "file": "09 参考资料/附件/L08 课件 PDF/PDF p08.jpg",
      "source": "pdf-render",
      "pdfPage": 8,
      "projections": [
        {
          "sessionIndex": 1,
          "startSec": 2848,
          "startMmss": "47:28",
          "timecodeSource": "platform-imageSeekTime-sec",
          "rawTimecode": "2848",
          "isReplay": false
        }
      ],
      "title": "Taxonomy of long-term memory",
      "contentType": "slide",
      "footerUnit": "KNOWLEDGE REPRESENTATION（记忆系统导入）",
      "pageNoScope": "section",
      "pageNoExpected": "03",
      "pageNoFullOcr": "03",
      "pageNoFooterOcr": "03",
      "pageNoNormalized": "03",
      "pageNoStatus": "verified",
      "isPureImagePage": true
    },
    {
      "index": 9,
      "file": "09 参考资料/附件/L08 课件 PDF/PDF p09.jpg",
      "source": "pdf-render",
      "pdfPage": 9,
      "projections": [
        {
          "sessionIndex": 1,
          "startSec": 2953,
          "startMmss": "49:13",
          "timecodeSource": "platform-imageSeekTime-sec",
          "rawTimecode": "2953",
          "isReplay": false
        },
        {
          "sessionIndex": 2,
          "startSec": 1,
          "startMmss": "00:01",
          "timecodeSource": "platform-imageSeekTime-sec",
          "rawTimecode": "1",
          "isReplay": false
        }
      ],